{
  "$schema": "../../../schemas/extension-manifest.schema.json",
  "id": "falcondeck.thread-tags",
  "name": "Thread Stages",
  "version": "0.3.0",
  "engines": {
    "falcondeck": "^0.1"
  },
  "entrypoint": "server.ts",
  "contributes": {
    "threadMenuActions": [
      {
        "id": "manage-tags",
        "title": "Set stage"
      }
    ],
    "threadDecorations": [
      {
        "id": "tag-chips",
        "view": "thread-tags"
      }
    ],
    "sidebarFilters": [
      {
        "id": "tags",
        "title": "Stages",
        "view": "tag-index",
        "ui": {
          "version": 1,
          "root": {
            "type": "select",
            "id": "stages",
            "label": "Filter by stage",
            "multiple": true,
            "options": [
              { "value": "backlog", "label": "Backlog", "tone": "gray" },
              { "value": "in_progress", "label": "In progress", "tone": "yellow" },
              { "value": "in_review", "label": "In review", "tone": "green" },
              { "value": "done", "label": "Done", "tone": "orange" },
              { "value": "canceled", "label": "Canceled", "tone": "gray" }
            ],
            "binding": {
              "view": "thread-tags",
              "path": ["tagIds"],
              "operator": "includes_any"
            }
          }
        }
      }
    ]
  },
  "permissions": []
}
